source,headline,url,content,image
Bloomberg,China Reopening Stocks Jump on Report of Covid Policy Easing,https://finance.yahoo.com/news/china-reopening-stocks-jump-report-015830654.html,"(Bloomberg) -- China’s consumer and retail shares rallied on Thursday after a report said that Beijing was weighing an exit from its strict Covid-Zero policy.Most Read from BloombergRussia’s Rating Cut to Junk; Talks on Tap: Ukraine UpdateChina Holds Talks With Ukraine, Further Edging Away From RussiaBillionaire Roman Abramovich Says He’s Selling Chelsea Football ClubChina Spy Think Tank Advising Xi Predicts Russia Sanctions Will BackfireTeen Who Tracked Elon Musk’s Jet Is Now Chasing Russian Ty",https://s.yimg.com/uu/api/res/1.2/uKwS8h0t_hKtsH8UvETefg--~B/Zmk9c3RyaW07aD0xMjM7cT04MDt3PTIyMDthcHBpZD15dGFjaHlvbg--/https://s.yimg.com/uu/api/res/1.2/bizrhPyLHXlcmwt4hmZksg--~B/aD02NzU7dz0xMjAwO2FwcGlkPXl0YWNoeW9u/https://media.zenfs.com/en/bloomberg_markets_842/076ebdfc35a86d77a2777a1cb9bee6c8.cf.jpg
Bloomberg,"Russia’s ‘Uninvestable’ Stocks Cut by MSCI, FTSE Russell Indexes",https://finance.yahoo.com/news/msci-removes-uninvestable-russia-emerging-224253546.html,"(Bloomberg) -- MSCI Inc. and FTSE Russell are cutting Russian equities from widely-tracked indexes, isolating the stocks from a large segment of the investment-fund industry.Most Read from BloombergRussia’s Rating Cut to Junk; Talks on Tap: Ukraine UpdateChina Holds Talks With Ukraine, Further Edging Away From RussiaBillionaire Roman Abramovich Says He’s Selling Chelsea Football ClubChina Spy Think Tank Advising Xi Predicts Russia Sanctions Will BackfireTeen Who Tracked Elon Musk’s Jet Is Now Ch",https://s.yimg.com/uu/api/res/1.2/UR5XWBHBvgUeafcMiBbu7w--~B/Zmk9c3RyaW07aD0xMjM7cT04MDt3PTIyMDthcHBpZD15dGFjaHlvbg--/https://s.yimg.com/uu/api/res/1.2/IkX2dn2Vd6UuEO9a8ewU7Q--~B/aD0xMzM0O3c9MjAwMDthcHBpZD15dGFjaHlvbg--/https://media.zenfs.com/en/bloomberg_markets_842/8383146d1eb1f4358dc18b143bd1a664.cf.jpg
Bloomberg,Stocks Rise on Powell Reassurance; Brent Tops $116: Markets Wrap,https://finance.yahoo.com/news/stocks-rise-bonds-drop-post-003706711.html,"(Bloomberg) -- Stocks rose Thursday in the wake of reassuring comments on monetary-policy tightening from Federal Reserve Chair Jerome Powell, while crude oil extended gains sparked by Russia’s invasion of Ukraine.Most Read from BloombergRussia’s Rating Cut to Junk; Talks on Tap: Ukraine UpdateChina Holds Talks With Ukraine, Further Edging Away From RussiaBillionaire Roman Abramovich Says He’s Selling Chelsea Football ClubChina Spy Think Tank Advising Xi Predicts Russia Sanctions Will BackfireTe",https://s.yimg.com/uu/api/res/1.2/lLlk1p6ygZE80A6rYhQxrQ--~B/Zmk9c3RyaW07aD0xMjM7cT04MDt3PTIyMDthcHBpZD15dGFjaHlvbg--/https://s.yimg.com/uu/api/res/1.2/j3_8kVMlpv1ZJWZ2H7NXtg--~B/aD0xMzM0O3c9MjAwMDthcHBpZD15dGFjaHlvbg--/https://media.zenfs.com/en/bloomberg_markets_842/39e842458ab366773c61f0d6f50e6c92.cf.jpg
Investor's Business Daily,"Dow Jones Futures: Stock Market Rallies On 'Nimble' Fed, 5 Chips Near Buys; SNOW Stock Crashes Late",https://finance.yahoo.com/m/2e1d8a04-f4e3-3701-8da9-90eafa47a924/dow-jones-futures-stock.html,"The rally attempt hasn't been confirmed yet. Chips are looking strong, but Snowflake is in meltdown.",https://s.yimg.com/uu/api/res/1.2/dbQKb4ga_MDerPimXl7qwQ--~B/Zmk9c3RyaW07aD0xMjM7cT04MDt3PTIyMDthcHBpZD15dGFjaHlvbg--/https://s.yimg.com/uu/api/res/1.2/meY_pPOZbC99Sio9Ig38Vw--~B/aD01NjM7dz0xMDAwO2FwcGlkPXl0YWNoeW9u/https://media.zenfs.com/en/ibd.com/9080cd15e60edbdf44f41f3d46db3472.cf.jpg
Barrons.com,Snowflake Stock Is Tumbling on a Disappointing Forecast. The CEO Has an Explanation.,https://finance.yahoo.com/m/d1aa3aef-f81b-380a-8c90-9c81a8246d6d/snowflake-stock-is-tumbling.html,The data-software firm projected fiscal 2023 results that were below Wall Street’s estimates. CEO Frank Slootman explains why.,https://s.yimg.com/uu/api/res/1.2/2dMsj0Ah7WsUpSTQh6gw8g--~B/Zmk9c3RyaW07aD0xMjM7cT04MDt3PTIyMDthcHBpZD15dGFjaHlvbg--/https://s.yimg.com/uu/api/res/1.2/AwFA76ryQwOjQTeiNpb0wQ--~B/aD02NDA7dz0xMjgwO2FwcGlkPXl0YWNoeW9u/https://media.zenfs.com/en/Barrons.com/ab76254539fa3b1d7c2ec9634991547a.cf.jpg
MarketWatch,"Splunk stock gains following surprise profit, new CEO",https://finance.yahoo.com/m/a755e80a-b206-365a-a8ca-f87568f4e0aa/splunk-stock-gains-following.html,"Splunk Inc. rose in the extended session Wednesday, as the cloud-based enterprise software company reported a surprise profit, topped Wall Street's outlook estimates and named a new chief executive.",https://s.yimg.com/uu/api/res/1.2/joJHH82mjcAUWqYA0i0orw--~B/Zmk9c3RyaW07aD0xMjM7cT04MDt3PTIyMDthcHBpZD15dGFjaHlvbg--/https://s.yimg.com/uu/api/res/1.2/ueQ5Fzj_JSx5.gCnpQH0jA--~B/aD02NDA7dz0xMjgwO2FwcGlkPXl0YWNoeW9u/https://media.zenfs.com/en/marketwatch.com/a15a4f3f4c22ebfae3bfc0029d6afdac.cf.jpg
MarketWatch,Snowflake stock plunges after annual forecast underwhelms,https://finance.yahoo.com/m/360f3c6e-67b0-3714-8996-5b519e324e55/snowflake-stock-plunges-after.html,Snowflake Inc. shares were clobbered in late trading Wednesday after the software company suggested sales will not grow as quickly as expected this year.,https://s.yimg.com/uu/api/res/1.2/dkJZQX2hag_hu5m7HpxhKw--~B/Zmk9c3RyaW07aD0xMjM7cT04MDt3PTIyMDthcHBpZD15dGFjaHlvbg--/https://s.yimg.com/uu/api/res/1.2/tDbbc_MCmWH1XgZ3M0hEFg--~B/aD02NDA7dz0xMjgwO2FwcGlkPXl0YWNoeW9u/https://media.zenfs.com/en/marketwatch.com/5ca8d295c1d457eb6fcf99f5f2d8255e.cf.jpg
TipRanks,2 Stocks Flashing Signs of Strong Insider Buying and Analyst Support,https://finance.yahoo.com/news/2-strong-buy-stocks-flashing-005459763.html,"Every investor wants to cut through the noise, and clear away the static of the market signals, but there are thousands of companies trading on the markets, and they put out all sorts of signs regarding their health, viability, and potential for success. Top investors will learn how to cut through that confusion to find that stock that are flashing the right signs – and show the highest potential for gains going forward. A clear signal is needed, and one of the clearest is the pattern of insider",https://s.yimg.com/uu/api/res/1.2/Fn3QBRCT_WLuIPZm9z00Kw--~B/Zmk9c3RyaW07aD0xMjM7cT04MDt3PTIyMDthcHBpZD15dGFjaHlvbg--/https://s.yimg.com/uu/api/res/1.2/xkIQd.uFxUCzi4BQJlDytw--~B/aD00NjM7dz04NTI7YXBwaWQ9eXRhY2h5b24-/https://media.zenfs.com/en/tipranks_452/aecfdf75629cc96c3884a2721fb172f5.cf.jpg
Bloomberg,Peloton Ex-CEO Sells $50 Million of Stock to Firm Linked to Michael Dell,https://finance.yahoo.com/news/peloton-ex-ceo-sells-50-235545185.html,"(Bloomberg) -- Peloton Interactive Inc. co-founder John Foley, who stepped down from the chief executive officer role last month, sold about $50 million in stock to MSD Partners, a firm that manages money for billionaire Michael Dell.Most Read from BloombergRussia’s Rating Cut to Junk; Talks on Tap: Ukraine UpdateChina Holds Talks With Ukraine, Further Edging Away From RussiaBillionaire Roman Abramovich Says He’s Selling Chelsea Football ClubChina Spy Think Tank Advising Xi Predicts Russia Sanct",https://s.yimg.com/uu/api/res/1.2/NtUEh5MMBQOJAK8KEqL2XQ--~B/Zmk9c3RyaW07aD0xMjM7cT04MDt3PTIyMDthcHBpZD15dGFjaHlvbg--/https://s.yimg.com/uu/api/res/1.2/YjChS_cgvp5kvZOJR6_4Vg--~B/aD0xMzMzO3c9MjAwMDthcHBpZD15dGFjaHlvbg--/https://media.zenfs.com/en/bloomberg_markets_842/61cf1ee1dfe2484f276164cc870844d3.cf.jpg
