source,headline,url,content,image
Barrons.com,This Analyst Sees Room for Gains in Toast Stock. Here’s Why.,https://finance.yahoo.com/m/24872993-783a-3e50-9f5f-35f9cab6ff04/this-analyst-sees-room-for.html,Baird analyst David Koning initiated coverage of the stock with a rating of Outperform and a target for the price well above its current level.,https://s.yimg.com/uu/api/res/1.2/UpcgTW31uFjTkmhQCUPGhg--~B/Zmk9c3RyaW07aD0xMjM7cT04MDt3PTIyMDthcHBpZD15dGFjaHlvbg--/https://s.yimg.com/uu/api/res/1.2/B6vy8vhIdc8BHgvg5oJkLQ--~B/aD02NDA7dz0xMjgwO2FwcGlkPXl0YWNoeW9u/https://media.zenfs.com/en/Barrons.com/710d8bc0e83907679a98a7e8080ce288.cf.jpg
Yahoo Finance,Hawaiian Airlines 'gearing up in anticipation of the Japanese market’: CEO,https://finance.yahoo.com/news/hawaiian-airlines-gearing-up-in-anticipation-of-the-japanese-market-ceo-193737301.html,Hawaiian Airlines CEO discusses the opening up of tourism in Japan as well as the future prospects for the travel industry in general.,https://s.yimg.com/uu/api/res/1.2/LiJKIBCly_m1G61nrPhulw--~B/Zmk9c3RyaW07aD0xMjM7cT04MDt3PTIyMDthcHBpZD15dGFjaHlvbg--/https://s.yimg.com/os/creatr-uploaded-images/2022-03/569e61c0-a497-11ec-bdfd-2e4fe57e7cc0.cf.jpg
MarketWatch,How details on shrinking Fed’s almost $9 trillion balance sheet might shake up markets more than a rate hike on Wednesday,https://finance.yahoo.com/m/58f60c01-29dc-3834-a44a-dc6cf68ec876/how-details-on-shrinking.html,B. of A. strategists Mark Cabana and Katie Craig are among those who see the likelihood that policy makers could produce new balance-sheet details this week.,https://s.yimg.com/uu/api/res/1.2/nFulg2yS4nR_2F9RU4C2Gw--~B/Zmk9c3RyaW07aD0xMjM7cT04MDt3PTIyMDthcHBpZD15dGFjaHlvbg--/https://s.yimg.com/uu/api/res/1.2/9vAgyj1uwDeVe0wGiaPJ_g--~B/aD02NDA7dz0xMjgwO2FwcGlkPXl0YWNoeW9u/https://media.zenfs.com/en/marketwatch.com/59f9ff293c8bb26d52967f3af3cf9fc8.cf.jpg
Investor's Business Daily,Bank Of America Stock Sees IBD Relative Strength Rating Climb To 76,https://finance.yahoo.com/m/02ce5cfd-46d1-38cd-9191-799ba976644b/bank-of-america-stock-sees.html,A Relative Strength Rating upgrade for Bank Of America shows improving technical performance. Will it continue?,https://s.yimg.com/uu/api/res/1.2/PYyVyXHFE_gtuvk0BkWZkg--~B/Zmk9c3RyaW07aD0xMjM7cT04MDt3PTIyMDthcHBpZD15dGFjaHlvbg--/https://s.yimg.com/uu/api/res/1.2/yK.1mixnMFPJb1QlWEF63Q--~B/aD01NjM7dz0xMDAwO2FwcGlkPXl0YWNoeW9u/https://media.zenfs.com/en/ibd.com/4f55f705c42c63544ad6253ec4f7e290.cf.jpg
Barrons.com,"Amazon, Alphabet and Eight Other Beaten-Up Growth Stocks Set to Soar",https://finance.yahoo.com/m/2dbb31e6-83e7-3a6e-9099-49099e74d32e/amazon-alphabet-and-eight.html,"Growth stocks have been walloped this year. Here are 10 that have more than 30% upside, according to average Wall Street price targets.",https://s.yimg.com/uu/api/res/1.2/HX.kfhMSic0rJg8MQWK9LQ--~B/Zmk9c3RyaW07aD0xMjM7cT04MDt3PTIyMDthcHBpZD15dGFjaHlvbg--/https://s.yimg.com/uu/api/res/1.2/ExIAQGO3qP6i8RLaJyW2QQ--~B/aD02NDA7dz0xMjgwO2FwcGlkPXl0YWNoeW9u/https://media.zenfs.com/en/Barrons.com/fefb72c5e07647ad04c8e70f35352637.cf.jpg
Yahoo Finance,Stock market news live updates: Stocks rise as investors look ahead to Fed rate decision,https://finance.yahoo.com/news/stock-market-news-live-updates-march-15-2022-224532968.html,Wall Street’s main benchmarks advanced Tuesday after stocks closed mostly lower to start the week. Investors continued to monitor the Russia-Ukraine war and braced for a key monetary policy decision due out of the Federal Reserve Wednesday that could place short-term interest rates above near-zero levels for the first time since 2018. A COVID outbreak in China also presented new headline risk for traders to digest.,https://s.yimg.com/uu/api/res/1.2/teyWuHCQD8DCX9gUE7T_TQ--~B/Zmk9c3RyaW07aD0xMjM7cT04MDt3PTIyMDthcHBpZD15dGFjaHlvbg--/https://s.yimg.com/os/creatr-uploaded-images/2022-03/4ac7ebf0-9ff6-11ec-bbdb-beb42fe12dfd.cf.jpg
MarketWatch,"A bet on stock-market volatility might saddle investors with hundreds of millions in losses, as Barclays makes a big change to funds",https://finance.yahoo.com/m/bbf04ae2-31e7-352c-aea2-647e8e9003c3/a-bet-on-stock-market.html,"Market participants attempting to bet on stock-market volatility are facing a reckoning Tuesday, as Barclays halts a fund pegged to VIX.",https://s.yimg.com/uu/api/res/1.2/ou7lYxNJbar3tDBkJKNbpg--~B/Zmk9c3RyaW07aD0xMjM7cT04MDt3PTIyMDthcHBpZD15dGFjaHlvbg--/https://s.yimg.com/uu/api/res/1.2/an61bZfG5ftl3wWzjS37uA--~B/aD02NDA7dz0xMjgwO2FwcGlkPXl0YWNoeW9u/https://media.zenfs.com/en/marketwatch.com/8c241e38a68c7858edd367b0e37c6899.cf.jpg
Investor's Business Daily,Murphy USA Stock Shows Rising Price Performance With Jump To 93 RS Rating,https://finance.yahoo.com/m/9b8f3f3a-72e5-30cb-91a7-f1e89f9e60b7/murphy-usa-stock-shows-rising.html,"Murphy USA stock saw a positive improvement to its Relative Strength (RS) Rating on Tuesday, with an increase from 90 to 93.  Is Murphy USA Stock A Buy?  Murphy USA stock is building a consolidation with a 202.30 buy point.",https://s.yimg.com/uu/api/res/1.2/O4znVs24oUL2AgWZoM5Ddg--~B/Zmk9c3RyaW07aD0xMjM7cT04MDt3PTIyMDthcHBpZD15dGFjaHlvbg--/https://s.yimg.com/uu/api/res/1.2/NwWA8TFUop1mTG1lrhrFew--~B/aD01NjM7dz0xMDAwO2FwcGlkPXl0YWNoeW9u/https://media.zenfs.com/en/ibd.com/62147566276b3a75eab1ea938001a116.cf.jpg
Yahoo Finance,Affirm ‘in control’ despite stock price plunge: Affirm CFO,https://finance.yahoo.com/news/affirm-in-control-despite-stock-price-plunge-affirm-cfo-191131590.html,"Despite recently raising its forward guidance for the 2022 fiscal year, Affirm shares crashed over 10% on Monday. Affirm CFO Michael Linford said that company performance “remains strong by virtually every measure,” and leadership will continue to focus on shaping the trajectory of the firm.",https://s.yimg.com/uu/api/res/1.2/ZRdCANgid5B0ttpE.1kiFQ--~B/Zmk9c3RyaW07aD0xMjM7cT04MDt3PTIyMDthcHBpZD15dGFjaHlvbg--/https://s.yimg.com/os/creatr-uploaded-images/2021-11/dede5030-426e-11ec-bbd6-905c03f560f6.cf.jpg
