source,headline,url,content,image
Investor's Business Daily,"Dow Jones Futures Fall, Slash Losses On Ukraine Nuclear Power Plant News",https://finance.yahoo.com/m/3b583f8b-c283-37bd-a4cc-ddc97c4e9e21/dow-jones-futures-fall-slash.html,"Futures dived, pared losses amid reports of a fire at a huge Ukraine nuclear power plant facility, under attack by Russian troops.",https://s.yimg.com/uu/api/res/1.2/VswMf765SI4ghJOXjD8Qmw--~B/Zmk9c3RyaW07aD0xMjM7cT04MDt3PTIyMDthcHBpZD15dGFjaHlvbg--/https://s.yimg.com/uu/api/res/1.2/oIMjIc5ViQ2cGM.EWTasaw--~B/aD01NjM7dz0xMDAwO2FwcGlkPXl0YWNoeW9u/https://media.zenfs.com/en/ibd.com/f408c2a91866eb8647765667fffecbd1.cf.jpg
MarketWatch,Asian markets slide as Russia shells Ukraine nuclear plant,https://finance.yahoo.com/m/8ce89ec8-6b7e-3cee-bbc4-655bbb5bf47a/asian-markets-slide-as-russia.html,"Shares were lower Friday in Asia after another bumpy day on Wall Street, as investors remain concerned about the broader impact of Russia’s invasion of Ukraine.",https://s.yimg.com/uu/api/res/1.2/hvqgq.IXadCiN8AnEceBgQ--~B/Zmk9c3RyaW07aD0xMjM7cT04MDt3PTIyMDthcHBpZD15dGFjaHlvbg--/https://s.yimg.com/uu/api/res/1.2/tZuEM2nToX2JWqwKcAvGwg--~B/aD02NDA7dz0xMjgwO2FwcGlkPXl0YWNoeW9u/https://media.zenfs.com/en/marketwatch.com/54ffd544bdf00da6239a8ed9c20b684a.cf.jpg
Bloomberg,Asia Stocks Slump to 16-Month Low as Ukraine Tensions Grow,https://finance.yahoo.com/news/asia-stocks-slump-16-month-042400728.html,(Bloomberg) -- Asian stocks tumbled to their lowest since November 2020 as signs Russia’s attack on Ukraine is intensifying further roiled financial markets. Most Read from BloombergEurope's Largest Nuclear Power Plant on Fire as Russia AttacksUkraine Update: Nuclear Watchdog on Alert After Attack on PlantRussia’s Rating Cut to Junk; Talks on Tap: Ukraine UpdateGerman Authorities Said to Deny Seizing Usmanov YachtResignation Sets In as Russians Face Their New Economic RealityThe MSCI Asia Pacifi,https://s.yimg.com/uu/api/res/1.2/m9EMrmnZxfz9vd5D5BOAbA--~B/Zmk9c3RyaW07aD0xMjM7cT04MDt3PTIyMDthcHBpZD15dGFjaHlvbg--/https://s.yimg.com/uu/api/res/1.2/FAVccZnSmYslN2qcx.2Z1A--~B/aD02NzU7dz0xMjAwO2FwcGlkPXl0YWNoeW9u/https://media.zenfs.com/en/bloomberg_markets_842/74735cfb48a8852abb8eb17f533e7cd7.cf.jpg
MarketWatch,Mortgage rates drop amid increased market uncertainty as Russia’s bombardment of Ukraine escalates,https://finance.yahoo.com/m/85879ef4-7ef2-3854-a186-42e663245dbd/mortgage-rates-drop-amid.html,How much of a respite Americans will see from rising interest rates could depend on what the Federal Reserve decides later this month.,https://s.yimg.com/uu/api/res/1.2/QvEL3Npgwd1RbRS8rSJKJg--~B/Zmk9c3RyaW07aD0xMjM7cT04MDt3PTIyMDthcHBpZD15dGFjaHlvbg--/https://s.yimg.com/uu/api/res/1.2/qa2kUf4OMwQcxazDuJijZA--~B/aD02NDA7dz0xMjc5O2FwcGlkPXl0YWNoeW9u/https://media.zenfs.com/en/marketwatch.com/c047461238eea5e0dfafcee053755dc9.cf.jpg
Bloomberg,Stock Futures Fall on Ukraine Nuclear Plant Attack: Markets Wrap,https://finance.yahoo.com/news/stocks-set-fall-amid-growth-224216405.html,"(Bloomberg) -- Stocks fell Friday along with European and U.S. equity futures, while havens including sovereign bonds rose, as investors reacted to an attack on a major nuclear power plant in Ukraine by Russian troops.Most Read from BloombergEurope's Largest Nuclear Power Plant on Fire as Russia AttacksUkraine Update: Nuclear Watchdog on Alert After Attack on PlantRussia’s Rating Cut to Junk; Talks on Tap: Ukraine UpdateGerman Authorities Said to Deny Seizing Usmanov YachtResignation Sets In as",https://s.yimg.com/uu/api/res/1.2/QwRNlbQ30i3RphrlPGWwjw--~B/Zmk9c3RyaW07aD0xMjM7cT04MDt3PTIyMDthcHBpZD15dGFjaHlvbg--/https://s.yimg.com/uu/api/res/1.2/H0XgWAS6kstht_buxuAqyg--~B/aD02NzU7dz0xMjAwO2FwcGlkPXl0YWNoeW9u/https://media.zenfs.com/en/bloomberg_markets_842/fc17d062d2415f62c120a70c2731c9bd.cf.jpg
TipRanks,"Rivian Stock Remains a Long-Term Story, Says RBC",https://finance.yahoo.com/news/rivian-stock-remains-long-term-032738654.html,"Nothing comes easy, right? A sentiment Rivian (RIVN) – and its investors – can relate to right now. As RBC’s Joseph Spak notes, the EV maker is “highly vertically integrated and is launching 3 new products (off two platforms) at the same time, in a new plant.” As such, the company has plenty to deal with. “The production ramp was always one of the biggest near-term risks to the story, and we expected there would be some hiccups along the way,” the analyst went on to say. And that has turned out",https://s.yimg.com/uu/api/res/1.2/Ecq_DwjahUoIhhgo6n3LGQ--~B/Zmk9c3RyaW07aD0xMjM7cT04MDt3PTIyMDthcHBpZD15dGFjaHlvbg--/https://s.yimg.com/uu/api/res/1.2/GHRcLDCnUXq73KoNcZO5lw--~B/aD01MTc7dz0xMDI0O2FwcGlkPXl0YWNoeW9u/https://media.zenfs.com/en/tipranks_452/b8e73c16af590e881bd8c1f0e31ab513.cf.jpg
TipRanks,Load up on ChargePoint Stock Following Q4 Earnings? This Analyst Says Yes,https://finance.yahoo.com/news/load-chargepoint-stock-following-q4-023612213.html,"Going by the initial reaction to ChargePoint’s (CHPT) latest quarterly earnings (F4Q22), it looks a company can now miss on either one of the top-and bottom-line metrics but as long as the outlook is favorable, investors don’t seem to mind. The EV charging station leader delivered EPS of -$0.23, falling short of the consensus forecast by $0.05. On the topline, however, the company beat the Street’s call by $4.57 million as revenue climbed 90.3% year-over-year to reach $80.7 million. More importa",https://s.yimg.com/uu/api/res/1.2/3IciOPXI1AZAo0dVI8nU5Q--~B/Zmk9c3RyaW07aD0xMjM7cT04MDt3PTIyMDthcHBpZD15dGFjaHlvbg--/https://s.yimg.com/uu/api/res/1.2/oX8wu4YF8smo4Bs5iybvtQ--~B/aD01MTY7dz0xMDI0O2FwcGlkPXl0YWNoeW9u/https://media.zenfs.com/en/tipranks_452/c0362a596a62a1d22c4eca10f281e973.cf.jpg
Investor's Business Daily,5 Best Chinese Stocks To Buy And Watch,https://finance.yahoo.com/m/e074e541-a391-3d14-a74d-dcf58539eb5c/5-best-chinese-stocks-to-buy.html,"Hundreds of Chinese companies are listed on U.S. markets. But which are the best Chinese stocks to buy or watch right now? JD.com , NetEase, Li Auto, Xpeng and BYD Co.. China is the world's most-populous nation and the second-largest economy with a booming urban middle class and amazing entrepreneurial activity.",https://s.yimg.com/uu/api/res/1.2/LZOlRB.FeJ.k1zr8FrQ1Zg--~B/Zmk9c3RyaW07aD0xMjM7cT04MDt3PTIyMDthcHBpZD15dGFjaHlvbg--/https://s.yimg.com/uu/api/res/1.2/WneqmBtsZgljDP2fI8nbuQ--~B/aD01NjM7dz0xMDAwO2FwcGlkPXl0YWNoeW9u/https://media.zenfs.com/en/ibd.com/921b5be5ac8c931a68a703b184467a49.cf.jpg
